tactica;idtactica;tecnica;idtecnica;otratacticaaplicable;ataque;herramientav;herramientaa;protocolo;ficheropcap;ataquecolateral;procesogeneracion;validacionpcap;analisisdeteccionespcap;detectablepatrones;mecanismodeteccion;detallesimplementacionataque;usadoparadetecciones;ficheropcaptruncado;deteccioncorreccionsyn;error_tcp_replay ;Detectabilidad;nivel_ataque_contexto;justificacion_nivel_ataque_contexto;nivel_ataque_osi;tramas_4000;usado_analisis_nivel_flujos;nflujos;nflujosconataque;nmensajesconataque;ninstanciastotales;ninstanciasprincipales;ninstanciascolaterales;nflujoscolaterales
Initial Access;TA0108;External Remote Services;T0822;_;Los atacantes aprovechan los servicios remotos externos como punto de acceso inicial a su red;Desconocida;Desconocida;BACnet;T0822-InitialAccess.pcapng;-;ICS_S4X15;-;Manual [5] / 5.4;SI;Trafico Bacnet ;;Si;T0822-InitialAccess.pcapng;CORRECTO;NO;SI;LV1;;L3;No comprobado;NO;0;0;0;0;0;0;0
Discovery;TA0102;Remote System Information Discovery;T0888;_;Obtener informacion detallada sobre la victima;Desconocida;Desconocida;PCCC;T0888-Discovery_2.pcapng;-;ICS_S4X15;-;Manual [5] / 5.4;SI;Trafico PCC o Trafico de descubrimiento ICMP;;Si;T0888-Discovery_2.pcapng;CORRECTO;NO;SI;LV2;Este archivo presenta la ejecucion periodica de ordenes CIP PPCC Execute y Diagnostic Status. Se supone que se trata de monitorizar dichos dispositivos. Se detecta el uso del protocolo HTTP donde se encuentra una posible transferencia de carga util a traves de XODA ;L3;No comprobado;NO;0;0;0;0;0;0;0
Discovery;TA0102;Network Sniffing;T0842;_;Monitorear u obtener informacion de la red;Desconocida;Desconocida;Modbus;T0842-Discovery.pcapng;-;ICS_S4X15;-;Manual [5] / 5.4;SI;Trafico de Lectura de registros Modbus;;Si;T0842-Discovery.pcapng;CORRECTO;NO;SI;LV1;-;L3;No comprobado;NO;0;0;0;0;0;0;0
Discovery;TA0102;Remote System Information Discovery;T0888;_;Obtener informacion detallada sobre la victima;Desconocida;Desconocida;Modbus;T0888-Discovery_3.pcapng;-;ICS_S4X15;-;Manual [5] / 5.4;SI;Trafico de Lectura de registros Modbus;;Si;T0888-Discovery_3.pcapng;CORRECTO;NO;SI;LV1;-;L3;No comprobado;NO;0;0;0;0;0;0;0
Initial Access;TA0108;External Remote Services;T0822;_;Los atacantes aprovechan los servicios remotos externos como punto de acceso inicial a su red;Desconocida;Desconocida;PCCC;T0822-InitialAccess_2.pcapng;-;ICS_S4X15;-;Manual [5] / 5.4;SI;Trafico PCC o Trafico de descubrimiento ICMP;;Si;T0822-InitialAccess_2.pcapng;CORRECTO;NO;SI;LV1;-;L3;No comprobado;NO;0;0;0;0;0;0;0
