tactica;idtactica;tecnica;idtecnica;otratacticaaplicable;ataque;herramientav;herramientaa;protocolo;ficheropcap;ataquecolateral;procesogeneracion;validacionpcap;analisisdeteccionespcap;detectablepatrones;mecanismodeteccion;detallesimplementacionataque;usadoparadetecciones;ficheropcaptruncado;deteccioncorreccionsyn;error_tcp_replay ;Detectabilidad;nivel_ataque_contexto;justificacion_nivel_ataque_contexto;nivel_ataque_osi;tramas_4000;usado_analisis_nivel_flujos;nflujos;nflujosconataque;nmensajesconataque;ninstanciastotales;ninstanciasprincipales;ninstanciascolaterales;nflujoscolaterales
Initial Access;TA0108;Exploitation of Remote Services;T0866;Lateral Movement;Acceso a red mediante vulnerabilidad del protocolo SMBv1;VM Winserver 2008;Metasploit: eternalblue_doublepulsar;SMBv1;T0866-VulnAccess-SMBv1_[2].pcapng;Comprobacion de la vulnerabilidad del sistema mediente Nmap;[2]/3.1.2;[2]/1.1;[2]/5.2.1.4/5.2.2.2/5.4.6/5.5.1;Si;Existen reglas para eternalblue para distintas firmas. Para este ataque es necesario una regla que detecte una firma especifica de eternalblue. Campo MultiplexID==82. verifica que el exploit ha tenido exito.;Mecanismos de deteccion empleados(regla diseñada);Si;T0866-VulnAccess-SMBv1_[2].pcapng;CORRECTO;NO;SI;LV1;El aprovechamiento de vulnerabilidades en el servicio SMB para realizar diferentes tareas maliciosas siempre constituye un ataque;L3;SI;SI;65;12;78;78;64;14;1
Initial Access;TA0108;Exploitation of Remote Services;T0866;Lateral Movement;Acceso a red mediante VNC;TightVNC + VM Winserver 2016;Metasploit: vnc_keyboard_exec.rb;VNC;T0866-RemoteAccess-VNC-FIXED_[2].pcapng;-;[2]/3.1.3;[2]/1.2;[2]/5.2.1.6/5.2.2.4/5.4.8/5.5.3;Si;Regla generica que detecte la transferencia de un binario de meterpreter + Regla que detecte una respuesta de un servidor VNC;-;Si;T0866-RemoteAccess-VNC_[2]-FIXED.pcapng;CORRECTO;NO;SI;LV1;El aprovechamiento de vulnerabilidades en el servicio VNC para realizar diferentes tareas maliciosas siempre constituye un ataque;L3;NO;SI;2;2;2;2;2;0;0
Initial Access;TA0108;Rogue Master;T0848;-;Envio de ordenes de control desde un Master no Legitimo; FreyrScada IEC 60870-5 Server Simulator; FreyrScada IEC 60870-5 Client Simulator;IEC-104 ;T0848-RogueMaster-IEC-104_[2].pcapng;-;[2]/3.1.4;[2]1.3;[2]/5.2.1.1/5.2.2.1/5.4.1/;Si;Regla que detecte que se estan ejecutando comandos de IEC-104 desde un rango de direcciones no deseado;-;Si;T0848-RogueMaster-IEC-104_[2].pcapng;CORRECTO;NO;SI;LV2;Las ordenes IEC-104 no siempre son consiredaras como un ataque. El administrador de red. dependiendo del entorno en el que se encuentre. puede permitir o no este tipo de trafico con el uso de unas direcciones IP  determinadas;L3;NO;SI;10;6;40;50;50;0;0
Initial Access;TA0108;Rogue Master;T0848;-;Envio de ordenes a outstation desde un master no legitimo;FreyrSCADA DNP3 Server (Outstation);FreyrSCADA DNP3 Client (Master);DPN3;T0848-RogueMaster-DNP3-FIXED_[1].pcapng;-;[1]/3.2;[2]/2.1;[1]/5.1.6/5.2.5/5.3.2/ ;Si;Regla que detecte que se estan ejecutando comandos de DNP3  desde un rango de direcciones no deseado;-;Si;T0848-RogueMaster-DNP3-FIXED_[1].pcapng ;T0848-RogueMaster-DNP3-FIXED_[1].pcapng (regenerado);NO;SI;LV2;Las ordenes DNP3 no siempre son consiredaras como un ataque. El administrador de red. dependiendo del entorno en el que se encuentre. puede permitir o no este tipo de trafico con el uso de unas direcciones IP  determinadas;L3;NO;SI;4;1;217;217;217;0;0
Execution;TA0104;Change Operating Mode;T0858;Evasion;Cambiar Modo de Funcionamiento de un PLC a RUN/STOP mediante ordenes FINS;"omron-fins-simulator
/omron_plc.rb";Node-red-contrib-omron-fins 0.5.0; FINS / UDP;T0858-ChangeOPMode-Omron_[2].pcapng;-;[2]/3.2.1;[2]/1.4;[2]/ 5.2.1.2/ 5.2.4.1/5.5.4;Si;Regla generica que compruebe si el contenido del paquete fins contiene el comando de Start/Stop;-;Si;T0858-ChangeOPMode-Omron_[2].pcapng;CORRECTO;NO;SI;LV2;Las ordenes FINS no siempre son consiredaras como un ataque. El administrador de red. dependiendo del entorno en el que se encuentre. puede permitir o no este tipo de trafico con el uso de unas direcciones IP  determinadas;L3;NO;SI;1;1;6;6;6;0;0
Privilege Escalation;TA0111; Explotation for privilege escalation;T0890;-;Escalado de privilegios a traves del Controlador de Dominio;VM Winserver 2016 con Active Directory;CVE-2020-1472 Zerologon Exploit;NetLogon;T0890-EscalPrivileges-NetLogon_[2].pcapng;-;[2]/3.3.1;[2]/1.5;[2]/ 5.2.1.5/5.2.2.3/ 5.4.7/ 5.5.2;Si;Reglas que encuentres solicitudes NetrServerReqChallenge y NetrServerAuthenticate con una cadena vacia.  repetidas enviadas a un servidor de Netlogon en un corto periodo de tiempo;-;Si;T0890-EscalPrivileges-NetLogon-FIXED_[2].pcapng;CORRECTO;Warning in tcpedit.c:tcpedit_packet() line 281: Unsupported protocol for checksum: 0x2;SI;LV1;El aprovechamiento de vulnerabilidades del protocolo Zerologon siempre sera considerado un ataque. independeintemente del entorno en el que se encuentre;L3;NO;SI;369;182;365;365;365;0;0
Discovery;TA0102;Remote System Discovery ;T0846;-;" Escaneo de direcciones IP que usen S7comm
 conectadas a la red ";S7-PLCSIM y TIA Portal V16 y NetToPlcSim;Nmap: s7-info.nse;S7comm;T0846-DiscoveryNmap-S7_[1].pcapng;-;[1]/3.3.1.1;[2]/2.2;[1]/5.1.6/5.2.5/5.3.4;No Salvo uso de reglas personalizadas;Regla que detecte paquetes por el puerto 102 que contengan funciones de obtencion de informacion acerca del PLC ;-;Si;T0846-DiscoveryNmap-S7_[1].pcapng;CORRECTO;NO;SI;LV2;No se trata de un escaneo agresivo. Un administrador de red podria hacer uso de nmap para obtener informacion de los dispositivos que se encuentren en su red;L3;NO;SI;4;1;3;3;3;0;0
Discovery;TA0102;Remote System Discovery ;T0846;-;"Escaneo de direcciones IP que usen Modbus
 conectadas a la red ";ModbusPal;Nmap: modbus-discover.nse;Modbus;T0846-DiscoveryNmap-Modbus_[1].pcapng;-;[1]/3.3.1.2;[2]/2.3;[1]/5.1.1/5.2.5/5.3.1;Si;Regla generica que detecte paquetes por el puerto 502 que contengan funciones de obtencion de informacion acerca del PLC ;-;Si;T0846-DiscoveryNmap-Modbus_[1].pcapng;CORRECTO;NO;SI;LV2;No se trata de un escaneo agresivo. Un administrador de red podria hacer uso de nmap para obtener informacion de los dispositivos que se encuentren en su red;L3;NO;SI;5;2;2;2;2;0;0
Discovery;TA0102;Remote System Discovery ;T0846;-;" Escaneo de direcciones IP que usen Modbus
 conectadas a la red ";ModbusPal;Metasploit modbusdetect. modbus_findunitid;Modbus;T0846-DiscoverMetasp-Modbus_[1].pcapng;-;[1]/3.3.1.2;[2]/2.3;[1]/5.1.1/5.2.5/5.3.1;Si;Regla generica que detecte paquetes por el puerto 502 que contengan funciones de obtencion de informacion acerca del PLC ;-;Si;T0846-DiscoverMetasp-Modbus_[1].pcapng;CORRECTO;NO;SI;LV2;No se trata de un escaneo agresivo. Un administrador de red podria hacer uso de nmap para obtener informacion de los dispositivos que se encuentren en su red;L3;NO;SI;1;1;1;1;1;0;0
Discovery;TA0102;Remote System Information Discovery;T0888;-;" Lectura de registros mediante
 mensajes Modubs";ModbusPal;"Metasploit: modbus_findunitid.
 modbusclient";Modbus;T0888-DiscverFindID-Modbus_[1].pcapng / T0888-DiscverCoils-Modbus_[1].pcapng / T0888-DiscverRegisters-Modbus_[1].pcapng / T0888-DiscverRegisters2-Modbus_[1].pcapng;-;[1]/3.9.4.1;[2]/2.4;[1]/5.1.1/5.2.5/5.3.1;Si;Regla generica que detecte paquetes por el puerto 502 que contengan funciones de obtencion de informacion acerca del PLC ;-;Si;T0888-DiscverFindID-Modbus_[1].pcapng / T0888-DiscverCoils-Modbus_[1].pcapng / T0888-DiscverRegisters-Modbus.pcapng / T0888-DiscverRegisters2-Modbus_[1].pcapng;CORRECTO;NO;SI;LV2;No se trata de un escaneo agresivo. Un administrador de red podria hacer uso de nmap para obtener informacion de los dispositivos que se encuentren en su red;L3;NO;SI;20;20;20;20;20;0;0
Discovery;TA0102;Remote System Information Discovery;T0888;-;Descubrimiento de informacion del outstation medinate DNP3;FreyrSCADA DNP3 Server (Outstation);FreyrSCADA DNP3 Client (Master);DNP3;T0888-DiscoverInfo-DNP3_[1].pcapng;-;[1]/3.3.2;[2]/2.5;[1]/5.1.6/5.2.5/5.3.2;Si;Regla generica que detecte paquetes por el puerto 20000 de DNP3 que contengan funciones de obtencion de informacion acerca del PLC ;-;Si;T0888-DiscoverInfo-DNP3_[1].pcapng;CORRECTO;NO;SI;LV2;No se trata de un escaneo agresivo. Un administrador de red podria hacer uso de nmap para obtener informacion de los dispositivos que se encuentren en su red;L3;NO;SI;3;1;30;30;30;0;0
Discovery;TA0102;Remote System Discovery;T0846;-;Escaneo de dispositivos BacNet en el puerto  47808 ;BacNet Device Simulator;Nmap:bacnet-info;BacNet/IP ;T0846-Discovery-BacNet_[2].pcap ;-;[2]/3.4.1.2;[2]/1.6;[2]/ 5.2.4.2/5.6.1.1;Si;Regla generica que detecte trafico con comandos de obtencion de informacion  BacNet por el puerto 47808;-;Si;T0846-Discovery-BacNet_[2].pcapng ;CORRECTO;NO;SI;LV2;No se trata de un escaneo agresivo. Un administrador de red podria hacer uso de nmap para obtener informacion de los dispositivos que se encuentren en su red;L3;NO;SI;4;1;9;9;9;0;0
Discovery;TA0102;Remote System Discovery;T0846;-;Escaneo de dispositivos mediante IEC-104 en el puerto 2404; FreyrScada IEC 60870-5 Server Simulator;Nmap:iec-identify;IEC-104 ;T0846-Discovery-IEC104_[2].pcapng;-;[2]/3.4.1.1;[2]/1.7;[2]/ 5.2.1.7/5.2.1.1;Si;Regla generica que detecte trafico con comandos de obtencion de informacion IEC-104 por el puerto 2404;-;Si;T0846-Discovery-IEC104_[2].pcapng;CORRECTO;NO;SI;LV2;No se trata de un escaneo agresivo. Un administrador de red podria hacer uso de nmap para obtener informacion de los dispositivos que se encuentren en su red;L3;NO;SI;39;29;66;66;66;0;0
Discovery;TA0102;Remote System Information Discovery;T0888;-;Escaneo y obtencion de informacion de un broker MQTT por el puerto 1883;Mosquitto MQTT broker;nmap:mqtt-subscribe;MQTT;T0888-ScanInfo-MQTT_[2].pcap / T0888-ScanInfo-MQTT-noAuth_[2].pcap;-;[2]/3.4.2.1;[2]/1.8;[2]/5.2.1.8/5.2.2.6/ 5.2.4.3;No Salvo uso de reglas personalizadas;Regla personalizada que detecte el paquete SubscribeRequest [&SYS/#] como posible intento de adquirir informacion del servidor a traves del puerto 1883 ;Mecanismos de deteccion no empleados;Si;T0888-ScanInfo-MQTT_[2].pcapng ;CORRECTO;NO;SI;LV2;No se trata de un escaneo agresivo. Un administrador de red podria hacer uso de nmap para obtener informacion de los dispositivos que se encuentren en su red;L3;NO;SI;4;1;3;3;3;0;0
Discovery;TA0102;Remote System Information Discovery;T0888;-;Descubrimiento de servidores OPC UA mediante escaneos agresivos con Nmap;Prosys OPCUA Server;nmap;OPC UA ;T0888-ScanInfo-OPCUA-Nmap_[2].pcapng;-;[2]3.4.2.2;[2]/1.9;[2]/5.2.1.7/5.2.2.5/ 5.2.3.2;Si;Multiples reglas personalizadas que detecten paquetes TCP SYN a los multiples puertos que se usan para servidores OPC UA;-;Si;T0888-ScanInfo-OPCUA-Nmap_[2].pcapng;CORRECTO;NO;SI;LV1;Este ataque es un escaneo agresivo en el que se trata de descubrir servidores a travesde numerosos puertos. Contiene paquetes TCP y UDP maliciosos que no son propios de actividades normales en la red. Por lo tanto. siempre sera un ataque;L3;NO;SI;76;72;139;139;139;0;0
Discovery;TA0102;Remote System Information Discovery;T0888;-;" Obtencion de informacion de 
un servidor OPC";Prosys OPCUA Server;opcua-scan;OPC UA ;T0888-ScanInfo-OPCUA-OpcScan_[2].pcapng;-;[2]/3.4.2.2;[2]/1.9;[2]/5.2.4.3/5.2.1.85.2.2.6;No salvo uso de reglas personalizadas;Multiples reglas personalizadas que detecten paquetes TCP SYN a los multiples puertos que se usan para servidores OPC UA;Mecanismos de deteccion no empleados;Si;T0888-ScanInfo-OPCUA-OpcScan_[2].pcapng;CORRECTO;NO;SI;LV2;Se usaun script para obtener infrmacion de los servidores OPCUA. Este caso no tiene por que ser siempre un ataque;L3;NO;SI;12;6;39;39;39;0;0
Discovery;TA0102;Remote System Information Discovery;T0888;-;Descubrimiento de un PLC Allen-Bradley;RSLogix 5000 ;Nmap:enip-info;Ethernet/IP;T0888-ScanInfo-ENIP_[2].pcapng;-;QuickDraw Dataset [3];[2]/1.10;[2]/ 5.2.1.8 /5.2.2.6/5.2.4.3;Si ;Regla generica que detecte el paquete RequestIdentity por el puerto 44818;-;Si;T0888-ScanInfo-ENIP_[2].pcapng;CORRECTO;NO;SI;LV2;No se trata de un escaneo agresivo. Un administrador de red podria hacer uso de nmap para obtener informacion de los dispositivos que se encuentren en su red;L3;NO;SI;2;1;1;1;1;0;0
Discovery;TA0102;Remote System Information Discovery;T0888;-; Descubrimiento de dispositivos mediante FINS;"omron-fins-simulator
/omron_plc.rb";nmap:omron-info; FINS /TCP;T0888-ScanInfo-OmronFINS_[2].pcapng;-;QuickDraw Dataset [3];[2]/1.11;[2]/ 5.2.1.2/5.2.4.1;Si ;Regla Generica que detecta paquetes Controller Data read por el puerto 9600;-;Si;T0888-ScanInfo-OmronFINS_[2].pcapng;CORRECTO;NO;SI;LV2;No se trata de un escaneo agresivo. Un administrador de red podria hacer uso de nmap para obtener informacion de los dispositivos que se encuentren en su red;L3;NO;SI;5;2;3;3;3;0;0
Lateral Movement;TA0109;Program Download;T0843;-;Subida y descarga de ficheros mediante IEC-104; FreyrScada IEC 60870-5 Server Simulator; FreyrScada IEC 60870-5 Clien Simulator;IEC-104 ;T0843-ProgDownload-IEC104_[2].pcapng;-;[2]/3.5.1;[2]/1.12;[2]/5.2.1.1/5.2.2.1/5.4.1/;Si ;Regla que detecte paquetes IEC-104 que contienen los tipos de dato correcpondiente a la subida /descarga de archivos.;-;Si;T0843-ProgDownload-IEC104_[2].pcapng;CORRECTO;NO;SI;LV2;Las ordenes IEC-104 no siempre son consiredaras como un ataque. El administrador de red. dependiendo del entorno en el que se encuentre. puede permitir o no este tipo de trafico con el uso de unas direcciones IP  determinadas;L3;NO;SI;7;1;1458;3508;3508;0;0
Lateral Movement;TA0109;Remote Services;T0886;Initial Access;Robo de credenciales de autenticacion de un broker MQTT;Mosquitto MQTT broker;Ncrack;MQTT;T0886-BruteForce-MQTT_[2].pcapng;-;[2]/3.5.2;[2]/1.13;[2]/ 5.2.1.8/5.2.2.6/5.2.4.3;No;Deteccion por anomalias. Multiples intentos de inicio de sesion desde el mismo origen durante un corto periodo de tiempo;-;Si;T0886-BruteForce-MQTT_[2].pcapng;CORRECTO;NO;SI;LV1;Este ataque trata de iniciar sesion multiples veces. en un corto periodo de tiempo a traves de MQTT (400intentos de inicio de sesion). Ademas utiliza la herramienta ncrak. Fortigate a traves de sus logs detecta el uso de esta herramienta. la cual es una herramienta maliciosa. Por lo tanto se ha considerado que siempre sera un ataque. Debido a la cantidad de veces que se trata de iniciar sesion y el uso de la herramienta. sera siempre un ataque;L3;NO;SI;400;400;401;401;401;0;0
Lateral Movement;TA0109;Program Download;T0843;-;Subida y descarga de ficheros a un PLC;FreyrSCADA DNP3 Server (Outstation);FreyrSCADA DNP3 Client (Master);DNP3;T0843-FileRead-DNP3-FIXED_[1].pcapng / T0843-FileWrite-DNP3-FIXED_[1].pcapng;-;[1]/3.9.4.4;[2]/2.6;[1]/5.1.6/5.2.5/5.3.2;Si;Regla generica que detecte paquetes DNP3 que contengan funciones relacionadas con la lectura/escritura de ficheros.;-;Si;T0843-FileRead-DNP3-FIXED_[1].pcapng / T0843-FileWrite-DNP3-FIXED_[1].pcapng ;T0843-FileRead-DNP3-FIXED_[1].pcapng / T0843-FileWrite-DNP3-FIXED_[1].pcapng (regenerado);NO;SI;LV2;Las ordenes DNP3 no siempre son consiredaras como un ataque. El administrador de red. dependiendo del entorno en el que se encuentre. puede permitir o no este tipo de trafico con el uso de unas direcciones IP  determinadas;L3;NO;SI;11;2;165;171;171;0;0
Lateral Movement;TA0109;Program Download;T0843;-;Subida y descarga de ficheros a un PLC;ModbusPal;PLCinjector;Modbus;T0843-FileDownload-Modbus_[1].pcapng / T0843-FileUpload-Modbus_[1].pcapng;-;[1]/3.4;[2]/2.7;[1]/5.1.1/5.2.5/5.3.1;Si;Regla generica que detecten paquetes Modbus que detecten contenido relacionado con lectura/escritura de registros;-;Si;T0843-FileDownload-Modbus_[1].pcapng / T0843-FileUpload-Modbus_[1].pcapng;CORRECTO;NO;SI;LV2;Las ordenes Modbus no siempre son consiredaras como un ataque. El administrador de red. dependiendo del entorno en el que se encuentre. puede permitir o no este tipo de trafico con el uso de unas direcciones IP  determinadas;L3;NO;SI;5;4;4;4;4;0;0
Collection;TA0100;Automated Collection;T0802;-;Obtencion automatica de informacion de un PLC Siemens a traves de OPC UA;TIA Portal V16 + PLCSIM Advanced V3.0;UAExpert;OPC UA;T0802-AutoCollect-OPCUA_[2].pcapng;-;[2]/3.6.1;[2]/1.15;[2]/ 5.2.1.8/5.2.2.6/5.2.4.3;No Salvo uso de reglas personalizadas;Regla que detectecte paquetes de ReadRequest/Response de OPC UA desde una red externa no autorizada;Mecanismos de deteccion no empleados;Si;T0802-AutoCollect-OPCUA_[2].pcapng;CORRECTO;NO;SI;LV2;Las ordenes OPCUA no siempre son consiredaras como un ataque. El administrador de red. dependiendo del entorno en el que se encuentre. puede permitir o no este tipo de trafico con el uso de unas direcciones IP  determinadas;L3;NO;SI;7;2;114;114;114;0;0
Collection;TA0100;Man In the Middle;T0830;-;Inundacion ARP para la recopilacion de datos de dispositivos BacNet;BacNet Device Simulator;YabeBacnetExplorer/Ettercap;BacNet/IP;T0830-MITM-BacNet-FIXED_[2].pcapng;-;[2]3.6.2;[2]1.16;[2]/5.2.4.2;Si;Regla generica que detecte lectura y escitura de variables mediante ordenes bacnet desde red no autorizada + Mapeo IP->MAC para deteccion de sobreescritura de cache ARP;Mecanismos de deteccion empleados (implementacion reglas de preprocesamiento + arpspoof);Si;T0830_MiTM-BacNet-FIXED_[2].pcapng;CORRECTO;"Warning in tcpedit.c:tcpedit_packet() line 281:
Unsupported protocol for checksum: 0x2";NO (Ver nota aclaratoria);LV2;Considerando que el ataque trata unicamente de detectar trafico del protocolo bacnet (sin tener en cuenta la suplantacion ARP) Las ordenes BACNET no siempre son consiredaras como un ataque. El administrador de red. dependiendo del entorno en el que se encuentre. puede permitir o no este tipo de trafico con el uso de unas direcciones IP  determinadas;L2;NO;SI;262;1;6892;6892;6892;0;0
Collection;TA0100;Automated Collection;T0802;-;Obtencion de informacion de un equipo a traves de SNMP;SIMATIC S7 PLCSIM Advanced V2.0;Metasploit: snmp_enum;SNMP;T0802-AutoCollect-SNMP_[1].pcapng;-;[1]/3.5;[2]/2.8;[1]/5.1.4/5.2.3;Si;Regla generica que detecte peticiones SNMP durante un periodo de tiempo ;-;Si;T0802-AutoCollect-SNMP_[1].pcapng;CORRECTO;NO;SI;LV2;Las ordenes SNMP no tiene por que ser un ataque;L3;NO;SI;1;1;45;45;45;0;0
Inhibit Response Function;TA0107;Data Destruction ;T0809;-;Borrado de memoria a PLC Omron;CX-One;Github: OMRON-FINS-ATTACK;FINS / UDP;T0809-DataDestroy-OMRON_[2].pcapng;-;[2]/3.10.1;[2]/1.17;[2]/5.2.1.2/ 5.2.4.1/ 5.5.4;si;"Regla generica que detecte paquete con el comando ""Memory card Format""";-;Si;T0809-DataDestroy-OMRON_[2].pcapng;CORRECTO;NO;SI;LV2;Las ordenes OMRON FINS no siempre son consiredaras como un ataque. El administrador de red. dependiendo del entorno en el que se encuentre. puede permitir o no este tipo de trafico con el uso de unas direcciones IP  determinadas;L3;NO;SI;1;1;93;93;93;0;0
Inhibit Response Function;TA0107;Denial of Service;T0814;-;Inundacion de fragmentos a servidor  OPC UA;opcua-asincio server;opcua-exploit-framework/chunk_flood;OPC UA ;T0814-DoS-OPCUA_[2].pcap;-;[2]/3.7.2;[2]/1.18;[2]/ 5.2.1.8/5.2.2.6/5.2.4.3;No;Deteccion por anomalias Chunk Type:C durante un periodo de tiempo.;Mecanismos de deteccion no empleados;Si;T0814-DoS-OPCUA_[2].pcapng;CORRECTO;NO;SI;LV1;El envio masivo de fragmentos en el que nunca se enviarña un mensaje opc ua de tipo F (mensaje opcua que o indica u final de un mensaje). Siemre consituira un ataque. Deteccion por anomalias--> Puede no ser detectado debido a tener una version simplificada del ataque. sera necesaria una configuracion de umbrales especifica para este protocolo;L3;SI;SI;1;1;463;463;463;0;0
Inhibit Response Function;TA0107;Device Restart/Shutdown;T0816;-;Reinicio a mediante envio de paquete SNMP a un PLC Allen Bradley;RSLogix 500 / RSEmulate500 / RSLinx;Ethersploit-IP	;SNMP;T0816-RestartAllenBradley-SNMP_[2].pcapng;-;[2]/3.7.1.1;[2]/1.19;[2]/ 5.2.1.4/5.2.3.2/5.5.6;Si ;Regla generica que detecta paquete SNMP set request con el Valor 2 al OID correspondiente;-;Si;T0816-RestartAllenBradley-SNMP_[2].pcapng;CORRECTO;NO;SI;LV1;El envio de un paquete modificado y al estar relacionado con una vulnerabilidad para este tipo de PLCs. Siempre sera considerado un ataque;L3;NO;SI;5;1;1;1;1;0;0
Inhibit Response Function;TA0107;Device Restart/Shutdown;T0816;-;"Orden de apagado mediante 
el protocolo S7comm";SIMATIC S7 PLCSIM Advanced V2.0;SIMATIC-SMACKDOWN;S7comm;T0816-StopCommand-S7Comm_[2].pcapng;-;[2]/3.7.1.2;[2]/1.20;[2]/ 5.4.3/5.2.1.8;Si;Regla personalizada que detecte paquete que contiene la funcion S7: PLC Stop;-;Si;T0816-StopCommand-S7Comm_[2].pcapng;CORRECTO;NO;SI;LV2;Las ordenes S7 no siempre son consiredaras como un ataque. El administrador de red. dependiendo del entorno en el que se encuentre. puede permitir o no este tipo de trafico con el uso de unas direcciones IP  determinadas;L3;NO;SI;1;1;1;1;1;0;0
Inhibit Response Function;TA0107;Denial of Service;T0814;-;DoS mediante protocolo PCCC;RS Logic 500;Metasploit: allen_bradley_pccc;PCCC;T0814-DoS-PCC_[1].pcapng;-;[1]/3.7.1;[2]/2.9;[1]/5.1.6/5.2.2/5.3.4/ 5.2.2.6;Si;Regla que detecte paquete PCC - protected typed logical read logical whith three address fields;-;Si;T0814-DoS-PCC_[1].pcapng;CORRECTO;NO;SI;LV1;El envio de un paquete modificado para aprovechar una vulnerabilidad en un PLC siempre sera un ataque;L3;NO;SI;9;1;1;1;1;0;0
Inhibit Response Function;TA0107;Device Restart/Shutdown;T0816;-;Apagado de PLC mediante orden CIP;RS Logic 500;Metasploit: multi_cip_command;CIP;T0816-ShtDownAllenBradley-CIP_[1].pcapng;-;[1]/3.7.2;[2]/2.10;[1]/5.1.3/5.2.5/5.3.4;Si;Regla que detecte orden de apagado del protocolo CIP;-;Si;T0816-ShtDownAllenBradley-CIP_[1].pcapng;CORRECTO;NO;SI;LV2;Las ordenes CIP no siempre son consiredaras como un ataque. El administrador de red. dependiendo del entorno en el que se encuentre. puede permitir o no este tipo de trafico con el uso de unas direcciones IP  determinadas;L3;NO;SI;9;1;1;1;1;0;0
Inhibit Response Function;TA0107;Device Restart/Shutdown;T0816;-;Apagado de dispositivos conectados a un PLC mediante la modificacion de variables que controlen dichos equipos;ModbusPal;Metasploit: modbusclient;Modbus;T0816-ShutDown-Modbus_[1].pcapng;-;[1]/3.9.2;[2]/2.11;[1]/5.1.1/5.2.5/5.3.1;Si;Regla que detecte paquetes modbus de lectura de multiples parametros;-;Si;T0816-ShutDown-Modbus_[1].pcapng;CORRECTO;NO;SI;LV2;Las ordenes Modbus no siempre son consiredaras como un ataque. El administrador de red. dependiendo del entorno en el que se encuentre. puede permitir o no este tipo de trafico con el uso de unas direcciones IP  determinadas;L3;NO;SI;1;1;1;1;1;0;0
Impair Process Control;TA0106;Modify Parameter;T0836;-;Modificacion de datos de memoria mediante Ordenes FINS;"omron-fins-simulator
/omron_plc.rb";Node-red-contrib-omron-fins 0.5.0;FINS / UDP;T0836-ModifyParam-OmronFINS_[2].pcapng;-;[2]/3.8.1;[2]/1.21;[2]/5.2.1.2/ 5.2.4.1;Si ;Regla generica que detecte paquetes Omron con comandos de lectura y escritura hacia el PLC;-;Si;T0836-ModifyParam-OmronFINS_[2].pcapng;CORRECTO;NO;SI;LV2;Las ordenes FINS no siempre son consiredaras como un ataque. El administrador de red. dependiendo del entorno en el que se encuentre. puede permitir o no este tipo de trafico con el uso de unas direcciones IP  determinadas;L3;NO;SI;10;10;10;10;10;0;0
Impair Process Control;TA0106;Modify Parameter;T0836;-;Modificacion de parametros medinate ordenes Modbus;ModbusPal;Metasploit: modbusclient;Modbus;T0836-ModifParam-Modbus_[1].pcapng;-;[1]/3.8;[2]/2.12;[1]/5.1.1/5.2.5/5.3.1;Si;Regla que detecta la escritura de parametros mediante paquetes modbus;-;Si;T0836-ModifParam-Modbus_[1].pcapng;CORRECTO;NO;SI;LV2;Las ordenes Modbus no siempre son consiredaras como un ataque. El administrador de red. dependiendo del entorno en el que se encuentre. puede permitir o no este tipo de trafico con el uso de unas direcciones IP  determinadas;L3;NO;SI;1;1;1;1;1;0;0
Impair Process Control;TA0106;Modify Parameter;T0836;-;Modificacion de parametros mediante ordenes S7comm;S7-PLCSIM y TIA Portal V16 y NetToPlcSim;Node-RED: contrib-s7comm;S7comm;T0836-ModifParam-S7_[1].pcapng;-;[1]/3.9.1;[2]/2.13;[1]/5.1.6/5.2.5/5.3.4;No Salvo uso de reglas personalizadas;regla personalizada que detecte paquetes S7 con la funcion Readvar y WriteVar;Mecanismos de deteccion no empleados;Si;T0836-ModifParam-S7_[1].pcapng;CORRECTO;NO;SI;LV2;Las ordenes S7 no siempre son consiredaras como un ataque. El administrador de red. dependiendo del entorno en el que se encuentre. puede permitir o no este tipo de trafico con el uso de unas direcciones IP  determinadas;L3;NO;SI;7;2;3;3;3;0;0
Command and Control;TA0101;Commonly Used Port;T0885;-;Camuflaje de trafico C&C al usar puertos estandar 502;RealWin Server;Metasploit: realwin_scpc_initialize;TCP;T0885-C&Cp502RWin-TCP_[1].pcapng / T0885-C&Cp502RWin-TCP-2_[1].pcapng / T0885-C&Cp502RWin-TCP-3_[1].pcapng;-;[1]/3.6.1;[2]/2.14;[1]/5.1.1/5.2.1/5.3.1;Si;Reglas que detecten paquetes de Excepcion de Modbus + Regla que detecte contenido que indique desbordamiento de SCPC_INITIALIZE;-;Si;T0885-C&Cp502RWin-TCP_[1].pcapng / T0885-C&Cp502RWin-TCP-2_[1].pcapng / T0885-C&Cp502RWin-TCP-3_[1].pcapng;CORRECTO;NO;SI;LV1;En este ataque se aprovecha una vulnerabilidad para RWINcon una CVE asociada. Esto siempre sera un ataque;L3;SI;SI;16;6;9;9;9;0;0
Command and Control;TA0101;Commonly Used Port;T0885;-;Camuflaje de trafico C&C al usar puertos estandar 502;Ignition;Metasploit: inductive_ignition_rce;HTTP;T0885-C&Cp502Ignition-HTTP_[1].pcapng;-;[1]/3.6.5;[2]/2.15;[1]/5.1.2/5.2.1/5.3.1;Si;Regla que detecte excepcion de paquete Modbus + regla que detecte la transferencia de archivo binario de windows meterpreter;-;Si;T0885-C&Cp502Ignition-HTTP_[1].pcapng;CORRECTO;NO;SI;LV1;En este ataque se aprovecha una vulnerabilidad para Ignition con una CVE asociada. Esto siempre sera un ataque;L3;SI;SI;6;4;5;5;5;0;0
